{
  "run_id": "RUN-07",
  "task_class": "external capability security and execution evaluation",
  "project": "Murat Project Engineer",
  "risk_tier": "VERIFIED",
  "baseline_or_coordinator": "murat-project-engineer",
  "experts_or_team": ["Researcher", "Reviewer"],
  "playbook": "verified",
  "route_profile": "cheap-research=opencode-go/deepseek-v4-flash; strong-review=gpt-5.6-sol",
  "duration": null,
  "deterministic_failures": 0,
  "reviewer_findings_useful": 3,
  "reviewer_false_positives": 0,
  "rework_count": 2,
  "human_interventions": 2,
  "escaped_defect_after_pass": false,
  "interruption_recovery_result": null,
  "fan_out_fan_in_needed": false,
  "durable_state_needed": false,
  "workflow_engine_pressure": false,
  "persistent_agent_pressure": false,
  "approximate_cost": null,
  "notes": "RUN-07=PASS means the controlled evaluation completed; it is not a tool approval. STRIX_EXECUTION=NOT_EXECUTED; STRIX_DECISION=HOLD; FREEBUFF_EXECUTION_DECISION=REJECT; CODEBUFF_PATTERN_DECISION=REUSE_COMPONENT. capability_version=strix_not_installed/freebuff_0.0.149; baseline_commit=mebeldocs:fad30491a851825018cbab6aa1fbae0c60857627,mpe:408f94915f997bf9e9ec87e53987a15e5d09b6af; comparison_baseline=existing_tests|codex|current_workflow; operational_overhead=MEDIUM. Controlled result: Codex 23 added lines/2 files/0 task rework/PASS; FreeBuff 72 added lines/1 file/1 human rework/semantic acceptance FAIL/WORSE. FreeBuff package and local runtime/config/history were removed. Additional rework records the user's correction that Codex Router route usage must be explicit and the baseline worktree basename correction."
}
