{
  "run_id": "RUN-11",
  "task_class": "bounded runtime coordination contracts",
  "project": "Murkin1980/murat-project-engineer",
  "risk_tier": "VERIFIED",
  "baseline_or_coordinator": "murat-project-engineer",
  "experts_or_team": ["Researcher", "Implementer", "Reviewer"],
  "playbook": "verified",
  "route_profile": "independent review -> opencode-go/deepseek-v4-pro via Codex Router",
  "duration": "bounded same-day run",
  "deterministic_failures": 0,
  "reviewer_findings_useful": 12,
  "reviewer_false_positives": 0,
  "rework_count": 3,
  "human_interventions": 2,
  "escaped_defect_after_pass": false,
  "interruption_recovery_result": "NOT_APPLICABLE: stateless bounded helpers only.",
  "fan_out_fan_in_needed": true,
  "durable_state_needed": false,
  "workflow_engine_pressure": false,
  "persistent_agent_pressure": false,
  "approximate_cost": "Exact Router cost not observable.",
  "notes": "Post-review hardening keeps Run 11 inside Option A+: message_id has schema/runtime path-safe parity; mailbox rejects reparse paths; duplicate delivery is tested across processes; JSONL has explicit single-writer ownership and retention guidance; canonical evidence was normalized. Metrics: handoff_count=2; handoff_schema_failures=0; event_count=10; worktree_collisions=1 synthetic collision detected; human_interventions=2; rework_count=3. RUNTIME_PATTERNS_DECISION=REUSE_COMPONENT. A poller, daemon, retry worker, router, scheduler, shared state, database, or generic messaging/runtime layer remains prohibited without a new filter and DEEP-CHANGE review."
}
