{
  "run_id": "RUN-08",
  "task_class": "public web browser evidence acquisition evaluation",
  "project": "Murat Project Engineer",
  "risk_tier": "VERIFIED",
  "baseline_or_coordinator": "murat-project-engineer",
  "experts_or_team": ["Researcher", "Reviewer"],
  "playbook": "verified",
  "route_profile": "research/extraction/normalization=opencode-go/deepseek-v4-flash",
  "duration": "approximately 2 hours",
  "deterministic_failures": 0,
  "reviewer_findings_useful": 6,
  "reviewer_false_positives": 0,
  "rework_count": 1,
  "human_interventions": 1,
  "escaped_defect_after_pass": false,
  "interruption_recovery_result": "PASS: resumed after explicit browser-creation confirmation",
  "fan_out_fan_in_needed": false,
  "durable_state_needed": false,
  "workflow_engine_pressure": false,
  "persistent_agent_pressure": false,
  "approximate_cost": "0 observed for local Chrome; external service cost UNKNOWN",
  "notes": "external_capability=BrowserAct; capability_version=skill_2.0.2/cli_1.4.0; baseline_commit=408f94915f997bf9e9ec87e53987a15e5d09b6af; comparison_baseline=ordinary_search_web_fetch; incremental_value=2_of_10_source_urls_recovered_after_direct_fetch_failure; operational_overhead=MEDIUM; decision=REUSE_COMPONENT. Records=29, validated=27, partial=2, duplicate=0, failed=0; unique_urls=10, unique_domains=9, normal_web_sufficient=8, browseract_added_value=0, browseract_required=2; validation_rate=93.1%, browser_incremental_value_rate=20%. Privacy=PASS, Business Discovery compatibility=YES, deep_change=NO. JSON schema validation uses the repository JSON schema files; the Markdown/JSON Experiment Record naming split remains an unresolved repository risk. Browser deletion remains subject to a separate explicit BrowserAct confirmation gate."
}
