{
  "run_id": "stage2a-run-01",
  "task_class": "repository/status/documentation hygiene",
  "project": "Murkin1980/murat-project-engineer",
  "risk_tier": "FAST",
  "baseline_or_coordinator": "murat-project-engineer",
  "experts_or_team": ["Coder"],
  "playbook": "FAST",
  "route_profile": null,
  "duration": null,
  "deterministic_failures": 0,
  "reviewer_findings_useful": 0,
  "reviewer_false_positives": 0,
  "rework_count": 0,
  "human_interventions": 0,
  "escaped_defect_after_pass": false,
  "interruption_recovery_result": null,
  "fan_out_fan_in_needed": false,
  "durable_state_needed": false,
  "workflow_engine_pressure": false,
  "persistent_agent_pressure": false,
  "approximate_cost": null,
  "notes": "Stage 2A evidence-format readiness. Populate duration and final gate observations from an observable execution environment when available."
}
