{
  "run_id": "RUN-11",
  "task_class": "bounded runtime coordination contracts",
  "project": "Murkin1980/murat-project-engineer",
  "risk_tier": "VERIFIED",
  "baseline_or_coordinator": "murat-project-engineer",
  "experts_or_team": ["Researcher", "Implementer", "Reviewer"],
  "playbook": "verified",
  "route_profile": "independent review -> opencode-go/deepseek-v4-pro via Codex Router",
  "duration": "bounded same-day run",
  "deterministic_failures": 0,
  "reviewer_findings_useful": 4,
  "reviewer_false_positives": 0,
  "rework_count": 2,
  "human_interventions": 1,
  "escaped_defect_after_pass": false,
  "interruption_recovery_result": "NOT_APPLICABLE: stateless bounded helpers only.",
  "fan_out_fan_in_needed": true,
  "durable_state_needed": false,
  "workflow_engine_pressure": false,
  "persistent_agent_pressure": false,
  "approximate_cost": "Exact Router cost not observable.",
  "notes": "Metrics: handoff_count=2; handoff_schema_failures=0; duplicate_message_count=1 detected; event_count=10; invalid_event_count=2 rejected in tests; worktree_collisions=1 synthetic collision detected; lifecycle_transition_failures=2 invalid cases rejected; human_interventions=1; rework_count=2. Handoff ambiguity, runtime observability, and collision visibility all improved. RUNTIME_PATTERNS_DECISION=REUSE_COMPONENT."
}
