{
  "run_id": "RUN-06",
  "task_class": "narrow-document",
  "project": "Murat Project Engineer",
  "risk_tier": "FAST",
  "baseline_or_coordinator": "murat-project-engineer",
  "experts_or_team": ["single-suitable-expert"],
  "playbook": "fast",
  "route_profile": null,
  "duration": null,
  "deterministic_failures": 0,
  "reviewer_findings_useful": 0,
  "reviewer_false_positives": 0,
  "rework_count": 0,
  "human_interventions": 0,
  "escaped_defect_after_pass": false,
  "interruption_recovery_result": null,
  "fan_out_fan_in_needed": false,
  "durable_state_needed": false,
  "workflow_engine_pressure": false,
  "persistent_agent_pressure": false,
  "approximate_cost": null,
  "notes": "Real FAST coordinator run. Synchronized STATUS.md and CHANGELOG.md with the mandatory New Idea Filter and added docs/OPERATING_MODEL.md. Fast playbook gates clean_diff_scope, secrets_scan, and artifact_exists passed using observable GitHub repository evidence. Run 05 remains historically BLOCKED and was not rewritten."
}
