{
  "run_id": "RUN-12",
  "task_class": "deterministic triage backtest",
  "project": "Murkin1980/murat-project-engineer",
  "risk_tier": "VERIFIED",
  "baseline_or_coordinator": "murat-project-engineer",
  "experts_or_team": ["Implementer", "Reviewer"],
  "playbook": "verified",
  "route_profile": "independent review -> opencode-go/deepseek-v4-pro via Codex Router",
  "duration": "bounded same-day run",
  "deterministic_failures": 0,
  "reviewer_findings_useful": 3,
  "reviewer_false_positives": 0,
  "rework_count": 2,
  "human_interventions": 1,
  "escaped_defect_after_pass": false,
  "interruption_recovery_result": "NOT_APPLICABLE",
  "fan_out_fan_in_needed": false,
  "durable_state_needed": false,
  "workflow_engine_pressure": false,
  "persistent_agent_pressure": false,
  "approximate_cost": "Exact Router cost not observable.",
  "notes": "EXP-12 v0.1 produced 20/20 retrospective fixture agreement and zero DEEP-CHANGE false negatives; prospective accuracy is NOT_OBSERVABLE. Rework fixed deterministic cleanup in the pre-existing RUN-11 Windows junction test and addressed Router review: maximum architecture impact now forces DEEP-CHANGE/human approval, inputs are validated, and retrospective framing is explicit. Prospective pre-registered validation is required before operational reliance. No Option A+ boundary changed."
}
